File Name,Result,Input Path,Indexless Input Path,Unmappable CDM Path Count,Unmappable CDM Paths,Reason For Failure
cdm-sample-files/mappers/example-10/example-10-1.xml,Fail_MappedNone,a(0).b.c.d,a.b.c.d,0,,Element with value FISH could not be mapped to a rosettaField
cdm-sample-files/mappers/example-10/example-10-1.xml,Fail_MappedNone,a(0).b.c.e,a.b.c.e,0,,Element with value CHIPS could not be mapped to a rosettaField
cdm-sample-files/mappers/example-10/example-10-1.xml,Fail_MappedNone,a(1).b.c.d,a.b.c.d,0,,Element with value MEAT could not be mapped to a rosettaField
cdm-sample-files/mappers/example-10/example-10-1.xml,Success,a(1).b.c.f,a.b.c.f,1,Root.zField.str1Field=[PIZZA],Element mapped to already populated field
cdm-sample-files/mappers/example-10/example-10-1.xml,Fail_MappedNone,a(1).b.c.e,a.b.c.e,0,,Element with value FISH could not be mapped to a rosettaField